,date,text
0,2020-03-14 23:59:58,"Feeding America has established a COVID-19 Response Fund to families get through the burdens of this Global Pandemic. Please join me in raising money this week for Feeding America. To reach my goal of $2,000, I'll be matching the first $500 in donations "
1,2020-03-14 23:59:56,This article about what’s happening in the White House is absolutely unbelievable. And terrifying. They truly have no idea what they are doing and no intention of getting the response to COVID-19 right. 
2,2020-03-14 23:59:50,the coronavirus waiting on the doorhandle of the door to another door Caroline polachek opened https://twitter.com/samdnte/status/1147384048752324609/video/1
3,2020-03-14 23:59:49,That’s what his ass get for playing with the coronavirus pic.twitter.com/JQH3fR7gxZ
4,2020-03-14 23:59:49,"I have never once downplayed the potential threat of corona, nor have I suggested anything other than personal caution. My hands are literally chapped. The only person who could infect my ailing wife is me, and I am going to extremes to avoid such a thing. But yes...."
5,2020-03-14 23:59:45,"It’s okay to be confused, uncertain, anxious or fear. Your feelings are valid. Here are things that aren’t cancelled during #coronavirus • Nature walk • Laughter • Music • Singing • Reading • Hope #StayHome #SocialDistancing #CoronaVirusUpdate #phdchat #phdlife #femtech"
6,2020-03-14 23:59:43,I’m a doctor In the (hopefully unlikely) event I catch corona and pass - I want part of my epitaph to read: DONALD TRUMP KILLED ME WITH HIS INCOMPETENCE
7,2020-03-14 23:59:39,I keep seeing people spread INNAPROPRIATELY wrong information on the Covid virus. It is NOT airborne. ( In the air) It IS droplet. ( Wet fluids from the infected could infected you) You CANNOT get the virus just by being around someone with it. WASH YOUR HANDS 
8,2020-03-14 23:59:38,"Letter from doc says “I received” results, which means he didn’t conduct test, which means, and let me choose my words carefully, IT’S A LIE. #coronavirus"
9,2020-03-14 23:59:36,"Follow this thread for local and global updates on the novel coronavirus, officially named as COVID-19 http://cnn.ph"
10,2020-03-14 23:59:31,"President @realDonaldTrump has declared tomorrrow a National Day of Prayer. Let’s pray for our president, health care providers and all those impacted by the #coronavirus. This is a time for all of us to come together."
11,2020-03-14 23:59:22,Chinese Tycoon Who Criticized Xi Response to Coronavirus Has Vanished... 
12,2020-03-14 23:59:18,It's like these dopes think COVID-19 doesn't exist. WTF? 
13,2020-03-14 23:59:02,"Off to bed, but my thoughts are with: all those diagnosed with COVID-19, and their loved ones our amazing NHS staff who are caring for people the experts trying to strategise in a rapidly evolving situation @MattHancock for his leadership in such a difficult time"
14,2020-03-14 23:59:00,"With many deprived of the Eucharist due to coronavirus covid-19, I'm reminded of the ancient Rite of Good Friday, where only the celebrant receives Communion, at which point the liturgy abruptly ends, leaving all with a profound sense of loss for Our Saviour who died for our sins "
15,2020-03-14 23:58:55,"Some very good, helpful #coronavirus #COVIDー19 info to know &amp; share!"
16,2020-03-14 23:58:45,UC Berkeley student has reportedly tested positive for COVID-19 
17,2020-03-14 23:58:39,Donald Trump now claims he tested negative for coronavirus. Here's the evidence trail that says he's probably lying. 
18,2020-03-14 23:58:35,CORONAVIRUS UPDATE — Kenya government suspends all public gatherings #COVIDー19
19,2020-03-14 23:58:23,"Just like every other world tour, the corona virus is avoiding Nova Scotia"
20,2020-03-14 23:59:58,"Sorry #COVID19Aus this is really dumb @DanielAndrewsMP @amapresident @normanswan Flog the troops before the battle Run the risk they get and transmit COVID-19 and then are isolated This is politics and money not healthcare Focus on the main game: plan, prepare, execute "
21,2020-03-14 23:59:53,I really do wish people would get the gravity of #Covid_19ireland #Coronavirusireland
22,2020-03-14 23:59:50,Time to bring the story back about Hunter Biden & Ukraine! With all this hysteria about the coronavirus the MSM had pushed it under the rug. We will not let the dems get away with criminal activity.
23,2020-03-14 23:59:49,The U.S. Capitol and House and Senate office buildings have closed their doors to the public until April as the federal government combats the spread of coronavirus https://cbsn.ws/39QetqV
24,2020-03-14 23:59:37,"""Carolyn Bourdeaux, a Democrat competing for a suburban U.S. House seat, called on state officials to administer the May 19 election by mail if the coronavirus outbreak grows worse.“It’s pretty simple,” she said. “Voting shouldn’t put your health at risk.” #gapol"
25,2020-03-14 23:59:36,This is not sound advocacy. Why push through a bill that would increase the number of people going into jails—especially during COVID-19? Is he trying to further disrupt our communities? #NoRollBacks to #BailReform
26,2020-03-14 23:59:31,Trump just said YESTERDAY he would be open to taking the coronavirus test and he got his results back TODAY after they said it takes DAYS for the results to come back??!!! HOW SWAY?!! 
27,2020-03-14 23:59:28,"Our audience is mostly younger and are at less risk of developing serious affects of Covid-19. However, you can still be a carrier and affect those more at risk. Be smart, wash your hands, work from home if able and practice social distancing (No bars, parties, &amp; large groups)"
28,2020-03-14 23:59:16,Giovanni Pozzi references this article and chart in his interview with @RaoulGMI . It is a must read piece - Coronavirus: Why You Must Act Now https://medium.com/@tomaspueyo/coronavirus-act-today-or-people-will-die-f4d3d9cd99ca updated today and translated into 26 languages
29,2020-03-14 23:59:12,"Carolina Hurricanes' broadcaster John Forslund is self-quarantining after possible coronavirus exposure thanks to staying in a hotel room Rudy Gobert stayed in the night before. ""Every time I sneeze or I cough, you wonder, 'Where’s this going?'"" "
30,2020-03-14 23:59:11,"#ShametheFlames Flames Ownership to Calgarians: We need your help to fund the new arena. Calgarians: Okay. &lt;COVID-19 hits&gt; Calgarians: Like other sports teams have done, ownership needs to step in &amp; help their employees out financially with the loss of work. Flames Ownership: "
31,2020-03-14 23:59:02,A second New Yorker has died from the coronavirus. The second COVID-19 victim was a 64-year-old man who had “other significant health problems which were likely contributory” to his death. 
32,2020-03-14 23:58:59,Have we reached the point yet where global panic is worse than the disease itself? I fear this more than the disease. #coronapocalypse #ShopperChaos #CommonSense #Reality #BeReal #coronavirus @lookner
33,2020-03-14 23:58:53,This taxpayer thanks @realDonaldTrump and his administration for rejecting proposals to the coronavirus supplemental bill that would force American taxpayers to fund abortion. 
34,2020-03-14 23:58:52,"Them: don’t go outside, it’s #corona season. Me: "
35,2020-03-14 23:58:48,Simple questions for simple @simoncoveney &amp; @LeoVaradkar: Have you been tested for #coronavirus since your return from the #WhiteHouse? Should either of you be in isolation? #LockdownIreland #CloseThePubs #Covid_19ireland #COVIDー19
36,2020-03-14 23:58:46,"Suspend rent and mortgage payments to support coronavirus affected, Jeremy Corbyn tells Boris Johnson "
37,2020-03-14 23:58:44,The argument that we need Medicare for All because of coronavirus isn’t a particularly strong one. But the argument that we need a better social safety net that could more easily activate in times of crisis is very strong.
38,2020-03-14 23:58:38,Bernie Sanders says President Trump “will have to bear responsibility for trying to diminish and minimize the impact of this [coronavirus] crisis.”
39,2020-03-14 23:58:30,I want to assure the residents of Pomona & surrounding cities that statements made my our local council member @Robert4Pomona &amp; Fed Rep @NormaJTorres are not facts. There are no plans to bring in individuals with COVID-19 to any armories including @CityofPomona
40,2020-03-14 23:58:24,"Since the coronavirus test involves literally sticking a swab up someone’s nose, I will strongly doubt Trump took it, unless there are photos of that swab going right up the schnoz. He lies about everything. Everything."
41,2020-03-14 23:58:18,"JUST IN: PBA Party list Rep. Jericho Nograles says the House of Representatives employee who tested positive for COVID-19 has passed away at 1:45AM today. Nograles asks all employees, congressmen, and those who visited the HOR to check for symptoms. | via @victoriatulad"
42,2020-03-14 23:58:17,President Trump tested negative for the coronavirus. Now all the 'journalists' demanding that he be tested without showing symptoms can start bitching that he took the test from someone who needed it.
43,2020-03-14 23:58:14,Senegal orders all schools closed in response to coronavirus https://reut.rs/3aXyex6
44,2020-03-14 23:58:13,Wow. Just wow. “At 10 pm massive applause was heard tonight in many Spanish cities in gratitude to health personnel and other professionals fighting the coronavirus” VIDEO 
45,2020-03-14 23:58:12,"Hello humans, I am the Coronavirus: I am going to explain to you why I have been doing such a great job in conquering the world. Open thread. (Based on scientific research &amp; @QHaRi’s thread. Updated, translated &amp; tweaked by @lalytatweets ) #CoronavirusPandemic #COVIDー19"
46,2020-03-14 23:58:11,"STAGE 4 (cont'd): A friend's relative died yesterday of corona because they couldn't treat him. It's chaos, the system is collapsing. Coronavirus and the crisis it's provoking is all you hear about everywhere."
47,2020-03-14 23:58:10,STAGE 4 (cont'd): That means that the elderly and trauma/stroke patients can't get treated because corona cases have priority. There's not enough resources for everybody so they have to be distributed for best outcome. I wish I was joking but it's literally what has happened.
48,2020-03-14 23:58:10," STAGE 4: The number of cases is heavily increasing. Schools and universities are closed everywhere for at least a month. It's a national health emergency. Hospitals are at capacity, entire units are cleared to make space for coronavirus patients."
49,2020-03-14 23:58:01,We have updated our message to the #UofT community regarding COVID-19 with information on measures currently in place. More: http://utoronto.ca/coronavirus
50,2020-03-14 23:58:00,"At least five Brazilians who traveled with President Jair Bolsonaro on a US visit that included meetings with his counterpart Donald Trump have tested positive for COVID-19, officials and media reports said "
51,2020-03-14 23:57:44,#SorryNotSorry to @speakerPelosi Trump tests negative for coronavirus: White House doctor statement http://va.newsrepublic.net/s/rUMbpe #cult45
52,2020-03-14 23:57:40,Singing makes more sense than stockpiling toilet paper... #coronavirus 
53,2020-03-14 23:57:40,Corona came just when I was becoming a gym babe
54,2020-03-14 23:57:31,Tell ICE to free immigrants in danger of COVID-19. #FreeThemAll Send an email to ICE with this tool https://www.raicestexas.org/2020/03/14/tell-ice-release-all-immigrants-at-risk-of-coronavirus/?ms=ctt20200314_tellice
55,2020-03-14 23:57:31,"Nice to hear your expertise on solving the Coronavirus shutdown. No substance and more spending , typical Liberal. The only solution is to promise more free shit to non free shit taxpayers. "
56,2020-03-14 23:57:31,"#Enemy of the People–Rude #Reporters Lash Out @#Trump Over #Coronavirus – #Media #Hysteria Causes Panic Buying,Americans Fight Over Toilet Paper VIDEOS Brawls broke out @#Costco #SamsClub&amp;grocery stores.. https://www.thegatewaypundit.com/2020/03/enemy-of-the-people-rude-reporters-lash-out-at-trump-over-coronavirus-media-hysteria-causes-panic-buying-americans-fight-over-toilet-paper-videos/ #QAnon #QAnon2018 #QAnon2020 #ChineseCoronavirus"
57,2020-03-14 23:57:28,Sorry democrats i know many of you are upset by this. Democrats hate America! Stay well ⁦@realDonaldTrump⁩ please take care of yourself! America needs you! President Donald Trump Tests Negative for Coronavirus #TrumpIsWell #NeverVoteDemocratAgain
58,2020-03-14 23:57:19,"#BREAKING: President Trump Tests Negative For Coronavirus, White House Says "
59,2020-03-14 23:57:06,"Officers seized counterfeit coronavirus test kits at LAX today, according to U.S. Customs and Border Protection. A package arrived at LAX from the United Kingdom and was labeled “Purified Water Vials,” according to a CBP news release. https://www.cbp.gov/newsroom/national-media-release/cbp-officers-seize-fake-covid-19-test-kits-lax"
60,2020-03-14 23:57:00,"Interesting how all these people who are like ""we didn't commit any genocides, it was diseases"" easily switch to ""the coronavirus is China's fault and they should apologize."" Just a little whisp of hypocrisy to really accentuate the more subtle elements of the racist bouquet."
61,2020-03-14 23:57:00,Iran coronavirus news: Khamenei tries to cover-up botched efforts to curb COVID-19 epidemic #Iran #COVIDー19
62,2020-03-14 23:56:57,"Thank you, God. Thank you, God. Thank you, God. In Jesus name, Amen. #TrumpTest #TrumpTestNegative #Coronavirus #COVIDー19 #WuhanMediaVirus #ChinaWuhanVirus @realDonaldTrump"
63,2020-03-14 23:56:34,What did I tell you... He’s on a mission from God. BREAKING: President Trump Tests Negative For Coronavirus https://www.thegatewaypundit.com/2020/03/breaking-president-trump-tests-negative-for-coronavirus/ via @gatewaypundit
64,2020-03-14 23:56:22, True North claims 97% of casual &amp; p/t workers at Wpg's Bell MTS Place don't rely on shifts for primary income &amp; won't be compensated for COVID-19 event cancellations. Co-owner David Thomson's fam is worth 41 BILLION. Messed up for True North to say who needs $&amp; who doesn't. 
65,2020-03-14 23:56:15,"What a game! Saint Louis was up 13 in the second half, but back-to-back-to-back 3's by @1DomoD helped the Bonnies rally back and advance, 83-82. We get VCU around 10:00 PM. BE THERE. Up next in the Corona Classic, Richmond and Davidson: https://www.youtube.com/watch?v=fL-Kx1lvonA&amp;feature=emb_title"
66,2020-03-14 23:56:14,'Many of the old sick people are left to die' Do not let it happen here. Stay Indoors! Maintain Social Distancing! Wag matigas ulo! #PlsRead #Covid_19PH #MMLockdown
67,2020-03-14 23:56:14,Update from the same medical team that diagnosed a very stable genius. Live Coronavirus Updates and Coverage - The New York Times 
68,2020-03-14 23:56:10,"My upstairs neighbor & friend that my family has been in contact with, was just diagnosed with #coronavirus. So, I'm going on self quarantine today, but we're going to keep fighting for what #WeOweUS from afar. Help us push forward http://www.VoteJFK.org – at 145th Street / Lenox Avenue (Malcolm X Blvd - 6th Ave) - Manhattan, NY"
69,2020-03-14 23:56:05,Prediction: You'll find out several CEOs hid their positive #coronavirus tests
70,2020-03-14 23:56:03,"""Vancouver pair tells the Star they've made $30K selling cleaning products on Amazon during COVID-19 pandemic"" https://www.cbc.ca/radio/asithappens/as-it-happens-friday-edition-1.5496727/b-c-couple-confronted-at-costco-for-buying-bulk-lysol-wipes-to-re-sell-for-profit-1.5496733 This is seriously maddening."
71,2020-03-14 23:56:02,Chinese Tycoon Who Criticized Xi’s Response to Coronavirus Has Vanished 
72,2020-03-14 23:56:01,My uber driver: coronavirus may be a conspiracy Me: why? Him: other viruses were worse. Makes you think. Me: makes you think what? Him: That it's a conspiracy Me: To do what? Him: Think about it
73,2020-03-14 23:56:00,A note on COVID-19 from @Littsburgh &amp; more in our latest newsletter: https://mailchi.mp/7987e6d339ff/a-note-on-covid-19-from-littsburgh 
74,2020-03-14 23:55:57,"In a matter of minutes yesterday @realDonaldTrump showed America how overmatched the Dems &amp; the #FakeNewsMedia are, explaining his meticulous all encompassing Corona Flu strategy and lifting America financially at the same time. Americans are safe! "
75,2020-03-14 23:55:57,"CORONAVIRUS Employees of a bus company in Paraguay's capital, Asuncion, fumigate a bus, and health workers check temperatures of those visiting the Justice Palace, as part of the government’s preventive measures to mitigate the spread of COVID-19. https://www.voanews.com/science-health/coronavirus-outbreak/coronavirus-could-test-latin-americas-already-ailing-economy"
76,2020-03-14 23:55:51,DURRR EVER1 SHOULD READ THIS RIVETING ANALYSIS ON HOW TRAFFIC ACCIDENTS ARE WORSE THAN CORONAVIRUS DURR CRY MORE LIBS
77,2020-03-14 23:55:43,"""Covid-19 For Dummies Like Me!: Why we felt we had to close"" 1. Fancy pants scientists have a number they call the ""R naught"" (shitty name btw) they use it to rate a virus in terms of how many people you might infect if you get it. This number is very important!"
78,2020-03-14 23:55:39,"""if you are homeless, if you are dealing with an addiction, if you are undocumented, what is going to happen to you?"" — @BernieSanders on how COVID-19 will affect the most vulnerable in our society. Joe Biden is not asking those questions or putting forward answers to them."
79,2020-03-14 23:55:30,"1/ If WH physician Sean Conley, DO signed off on both the March 13 letter stating coronavirus testing isn't indicated AND the March 14 letter stating Trump tested negative, why are the signatures PRECISELY THE SAME? (Digital signatures are common, but this looks handwritten) "
80,2020-03-14 23:55:22,"Cristiano Ronaldo will transform his chain of hotels in Portugal into free hospitals that will be used to help combat coronavirus. Ronaldo, who is currently in self-isolation in Madeira, will pay the wages of the workers &amp; doctors. "
81,2020-03-14 23:55:14,"RESULTS ARE IN : NEGATIVE President Trump tests negative for coronavirus, White House says "
82,2020-03-14 23:55:09,"New York Governor Cuomo confirms increase of 115 coronavirus cases in New York City, 613 confirmed cases statewide"
83,2020-03-14 23:55:07,"So far: The risk of catching Coronavirus and dying from it ... Is 100 times less Than catching the flu And dying from the flu. I predict there will be fewer than 100,000 deaths worldwide from Corona. Flu killed 3 quarters of a million in the past year alone. Corona is a scam."
84,2020-03-14 23:55:06,We will be opening back up Monday! Amidst all the corona virus news we will still be open for our regular business hours. #RailsOverCorona
85,2020-03-14 23:55:02,"Very thankful that our President, @realDonaldTrump has tested negative for the coronavirus. "
86,2020-03-14 23:54:59,Also wish we'd said this... #auspol #coronavirusaustralia #coronapocalypse #coronavirus 
87,2020-03-14 23:54:55,"Obama: ""Ultimately, the buck stops with me. As President, I have a solemn responsibility to protect our nation and our people, and when the system fails, it is my responsibility.” Trump: “No, I don’t take responsibility at all.” #coronavirus #COVIDー19 #TrumpPlague"
88,2020-03-14 23:54:53,Disgusting libel. Nothing could be further from the truth. Israeli authorities were quick to assist the PA on coronavirus preparation. 
89,2020-03-14 23:54:52,JUST IN: An airline agent at San Francisco Intl Airport tests positive for coronavirus.
90,2020-03-14 23:54:51,"Mismanagement, missed opportunities: How the White House bungled the coronavirus response. Trump’s own advisers acknowledged to NBC News that the failure to focus on widespread testing was a major misstep. https://www.nbcnews.com/politics/white-house/mismanagement-missed-opportunities-how-white-house-bungled-coronavirus-response-n1158746"
91,2020-03-14 23:54:43,WH said Trump tested negative for #Coronavirus We will never be sure about this because the WH has lied every single day of this administration It’s sad we can’t trust the leader of our country. He has manipulated us for far too long! We need a leader! 
92,2020-03-14 23:54:42,Corona going trying stop us for voting watch they on some bullshit
93,2020-03-14 23:54:40,It’s hard to test for COVID-19 with a nasal swab when the nose is full of Adderall... Just saying.
94,2020-03-14 23:54:38,"Why outbreaks like coronavirus spread exponentially, and how to “flatten the curve” - fascinating visualization/simulation using bouncing balls, with a chilling kicker https://www.washingtonpost.com/graphics/2020/world/corona-simulator/"
95,2020-03-14 23:54:36,Donald Trump now claims he tested negative for coronavirus. Here’s the evidence trail that says he’s probably lying. 
96,2020-03-14 23:54:35,"Trump Tests Negative for Coronavirus, According to His Doctor: He Remains 'Symptom-Free' "
97,2020-03-14 23:54:27,"Look, I think the WH statement that Trump tested negative for coronavirus is probably true. But getting people to believe these statements when they’re important is a reason they shouldn’t have lied about his weight."
98,2020-03-14 23:54:27,"CNN’s Jim Acosta Calls Trump Racist For Pointing Out Origin of Coronavirus – Just Weeks After He Did the Same Thing The Wuhan Coronavirus did come from China, just ask Acosta he tweeted it ( SEE BELOW) ! So it must be true! You guess it – racist! https://truepundit.com/cnns-jim-acosta-calls-trump-racist-for-pointing-out-origin-of-coronavirus-just-weeks-after-he-did-the-same-thing/"
99,2020-03-14 23:54:05,"Not only do I not believe Trump tested negative, I don’t believe this lying sack of crap was tested at all: Donald Trump tests negative for coronavirus - CNNPolitics #POSPOTUS #TrumpIsTheWORSTPresidentEVER #TrumpPlague #TrumpVirus"
100,2020-03-14 23:54:02,Washing your hands prevents the coronavirus from spreading. Washing your hands prevents the coronavirus from spreading. Washing your hands prevents the coronavirus from spreading. Washing your hands prevents the coronavirus from spreading.
101,2020-03-14 23:54:01,The sick joke of Donald Trump's presidency isn't funny any more #coronavirus #DonaldTrump #DonTheCon #fakepresident
102,2020-03-14 23:53:48,"As with the #bushfires, the ABC proving to be the gold standard go-to for #coronavirus fact, detail &amp; instruction. Reference it &amp; value it."
103,2020-03-14 23:53:47,"The wife of Spanish Prime Minister Pedro Sánchez has tested positive for the new coronavirus, according to Spain's government. "
104,2020-03-14 23:53:42,"CCSD Coronavirus Response Update - March 14, 2020. Visit http://ccsd.net for updated information."
105,2020-03-14 23:53:39,My mom: A) trying to kill the #coronavirus. B) dealing with her anxiety about getting back to Canada. C) just going her thang. 
106,2020-03-14 23:53:38,"Newt Gingrich, the politician who for 30 years lead right-wing charge to destroy ""Big Government"" and its ability to protect public, now says Big Government is the solution to the Covid-19 pandemic. "
107,2020-03-14 23:53:37,BREAKING Newt Gingrich: I Am in Italy Amid the Coronavirus Crisis. America Must Act Now—And Act Big Is it still a “Democratic hoax?” #TrumpPlague #StayHome
108,2020-03-14 23:53:31,Damn I can’t believe COs ....the only people allowed outside....are the ones bringing coronavirus into the prisons. Really makes you think.
109,2020-03-14 23:53:29,Economists agree: Much more help for the bottom half is essential. Helping the rich is pointless. How Trump and the GOP neutered the coronavirus relief bill passed last night to help corporations https://occupydemocrats.com/2020/03/14/how-trump-and-the-gop-neutered-the-coronavirus-relief-bill-passed-last-night-to-help-corporations/ via @OccupyDemocrats
110,2020-03-14 23:53:18,"We need to #StopTheSpread now! Get away from the pubs, clubs, public spaces and crowds, and go home. Take this image and post it - tag 10 people to do the same. Stay safe - stay spaced! #coronavirus "
111,2020-03-14 23:53:13,This coronavirus chart shows Canada is NOT 'flattening the curve'—at least not yet - http://Macleans.ca
112,2020-03-14 23:53:07,JUST IN: Trump tests negative for coronavirus http://hill.cm/r6JEO0N
113,2020-03-14 23:53:04,"""Azan (call to prayer) being made in Kuwait today. Instead of Hayya 'ala al-Salah (come to prayer) the muadhin says al-Salatu fi buyutikum (pray in your homes) This was done in the time of Prophet ﷺ during heavy rain and wind. It was done today in Kuwait due to #coronavirus."" "
114,2020-03-14 23:53:03,The Coronavirus pandemic has me wondering if the guy who created the Mayan calendar was dyslexic... 2012 oops I meant 2021 
115,2020-03-14 23:52:56,"Infectious disease specialists explain what’s known (and what isn’t) so far about the new coronavirus disease, COVID-19. "
116,2020-03-14 23:52:54,President Trumps Coronavirus test comes out negative and the liberal conspiracy theorist have come out in full force. They have lost their minds.
117,2020-03-14 23:52:48,"Defining incompetence: “The Trump administration’s zigzagging, defensive, inconsistent messages about the novel coronavirus continued Friday, breaking almost every rule in the book and eroding the most powerful weapon officials possess: Public trust.” "
118,2020-03-14 23:52:47,Iran's coronavirus 'diagnosis' app looks more like a surveillance tool https://engt.co/3aOeVGq
119,2020-03-14 23:52:33,"Claims that financial condition shapes #highered responses to COVID-19 are irresponsible. disconnected. I see heroic focus on public health, student success, rapidly reskilling employees Those in comfy balcony seats? Maybe step into the pit &amp; check it out "
