,date,text
658,2020-03-14 23:09:42,"https://patents.justia.com/assignee/the-pirbright-institute Coronavirus Patent number: 10130701 Date of Patent: November 20, 2018 Assignee: THE PIRBRIGHT INSTITUTE Inventors: Erica Bickerton, Sarah Keep, Paul Britton Funded by Bill Gates. He resigned from Board of Directors at Microsoft a few days ago."
659,2020-03-14 23:09:42,BREAKING: Wife of Spain's Prime Minister tests positive for coronavirus
660,2020-03-14 23:09:39,"""The administration’s struggle to mitigate the coronavirus outbreak has been marked by infighting and blame-shifting, misinformation and missteps, and a slow recognition of the danger."" "
661,2020-03-14 23:09:37,#Pakistan says it is ready to extend assistance to its neighbours amid the coronavirus outbreak. #CoronaVirusUpdates #CoronavirusPandemic #SAARC Pak ready for Saarc video call after PM Modi suggests joint Covid-19 strategy - india news - Hindustan Times 
662,2020-03-14 23:09:36,"While Canadians were being warned [some would say lectured] about racism by our Governments and public health officials, Taiwan, Hong Kong and Singapore were all taking effective action after China finally revealed the outbreak of the coronavirus #cdnpoli #bcpoli"
663,2020-03-14 23:09:32,"This 100%. My wife is a Respiratory Therapist who worked through SARS, H1N1, and now the Coronavirus. I have immense respect for her and her peers working to protect us. "
664,2020-03-14 23:09:27,"Filipinos, It's QUARANTINE not PRISON. It's RESTRICTION not MARTIAL LAW. Don't make things worse because of your stupidity, carelessness and spoiled attitude. #Covid_19PH #PrayForPhilippines"
665,2020-03-14 23:09:21,"SOMEONE JUST SAID THAT EMMA, CLEO, & RIKKI CANT WASH THEIR HANDS DURING THE CORONAVIRUS CRISIS AND WILL MOSTELY DIE. I AM SCREAMING!! "
666,2020-03-14 23:09:15,question: does coronavirus make kids act like they're 55? 
667,2020-03-14 23:09:02,We are not “politicizing the coronavirus” by calling out Trump for his criminal and sociopathic mismanagement of this crisis. @GerryConnolly’s response to the notion that Democrats are politicizing this to “score political points against Trump” was perfect
668,2020-03-14 23:09:00,"Shakespeare: Quarantined during the plague. Wrote “King Lear,” “Macbeth,” and “Antony and Cleopatra.” Me: Quarantined during COVID-19. Stress eats lasagna. Binge watches “Say Yes to the Dress.” Writes tweets."
669,2020-03-14 23:08:58,"Because everything has its solution ..let’s merge our hearts for saving humanity all of us now in the hand of God Almighty ..he only will save us from this curse named coronavirus .. Pray &amp; pray Love,be kind &amp; pray Now nothing left except prayers ...... "
670,2020-03-14 23:08:48,Totally incompetent of @UKgovt to brief draconian #coronavirus plans off the record in response to criticism.
671,2020-03-14 23:08:47,"Oh, you mean like 95 masks and the Covid tests that we’re not getting, which is leading of a lack of knowledge as to where the virus is spreading, and will result in more deaths? "
672,2020-03-14 23:08:47,EU open borders project is collapsing! 8 countries are CLOSING borders due to corona virus. - Norway - Denmark - Austria - Slovakia - Slovenia - Poland - Latvia - Czech Republic This is unprecedented time in history. RETWEET! 
673,2020-03-14 23:08:45,Remember trump said the US had 11 cases of covid-19? Well 57 of the 11 have died.
674,2020-03-14 23:08:36,"I was telling somebody today there int no secrets in Barbados. If somebody test positive for corona, the lab technician gine home and tell he woman, she gun tell she mother and she friends, then everybody know. So knowing bajans I dont think the government would bother to hide it"
675,2020-03-14 23:08:30,I'm compiling all of the Portland-specific COVID-19 information I see on this page: https://pdxcovid19.glitch.me/
676,2020-03-14 23:08:29,Suggestion: Federal and state resources dedicated to Tobacco Control be redirected to tackling COVID-19. I’m not sure we need more multimillion dollar studies about bright colors making ppl vape or how e-cigs cause heart attacks before you use them #realpublichealth
677,2020-03-14 23:08:27,https://www.sandiegouniontribune.com/opinion/editorials/story/2020-03-12/coronavirus-covid-19-trump-biden Trump sought to frame the coronavirus crisis with xenophobic bombast about killing the “foreign” virus and shutting down air travel “and a tremendous amount of trade and cargo” to Europe. Trump demonstrated once again he has no grasp of reality.
678,2020-03-14 23:08:17,Here’s Ben Carson obliviously demonstrating how not to cough in public during today’s coronavirus press conference immediately after Pence touted his credentials 
679,2020-03-14 23:08:02,How do we get a hashtag trending? #TRUMPisTheRealNationalEmergency #TRUMPisTheRealNationalEmergency #TRUMPisTheRealNationalEmergency #TRUMPisTheRealNationalEmergency #TRUMPisTheRealNationalEmergency NEEDS TO BE TRENDING NOW!! Charcoal/pastels drawing #coronavirus 
680,2020-03-14 23:07:59,"Because @UWVirology is currently running at full capacity for #SARSCoV2 #CoronavirusUSA #HCoV19 testing, as of Monday 3/16 we will not be able to accept SARS-CoV-2 (COVID-19) PCR orders from locations that are not already established @UWMedicine Laboratory Medicine clients."
681,2020-03-14 23:07:58,Coronavirus! At The Disco
682,2020-03-14 23:07:53,#Breaking: #France on lockdown. Only supermarkets and pharmacies are allowed to remain open starting midnight (0:00 Paris Time). #CoronaVirus 
683,2020-03-14 23:07:48,[coronavirus] I don’t know where neurotypicals get off complaining that ADHD and autistic people can’t sit still when apparently “just stay the fuck home for ten hot seconds” is Literally Impossible and all the NTs are Literally Going To Die if they can’t go to the bar tonight
684,2020-03-14 23:07:43,"The news of a new born baby contracting the corona virus, has absolutely petrified me, I won’t lie. I’ve got a 19 month old and my missus is 13 weeks pregnant. Am I overreacting?"
685,2020-03-14 23:07:40,Coronavirus quarantine so crazy I haven’t had sex in a decade
686,2020-03-14 23:07:23,"Yes, you will get to squeeze the Charmin again —>> Even amid coronavirus, U.S. toilet paper supply remains reliable - Los Angeles Times "
687,2020-03-14 23:07:22,"From nationally respected EMS leader: ""OSHA does not consider EMS to be healthcare workers. So we are having trouble getting N-95s from the national strategic stockpile for this reason."" #COVID19 #Coronavirus #SARSCoV19 #FOAMed #FOAMems"
688,2020-03-14 23:07:21,"Trump, Kushner ways. It seems we are now learning Kushner’s brother will be selling US tax payers the Corona test kits as well?How much gauging do you expect ? Sticking it to US to help US?Was this the reason for delay in testing? In order to set up families profiteering?"
689,2020-03-14 23:07:20,"After consultation with local public health officials, @ChurchillDowns will delay the reopening of its stable areas for two weeks until Tuesday, March 31 amid public health concerns regarding COVID-19. Story: https://bit.ly/39Uh8QG"
690,2020-03-14 23:07:00,"To those in the pubs you should also be aware that alcohol weakens the body’s immune system in various ways, increasing susceptibility to viral infection. As well as infecting others you may not be so invincible yourselves. #COVID19 #pubs #alcohol #coronavirus "
691,2020-03-14 23:06:54,"After receiving an update from State officials late today on the current impact of the COVID-19 virus, Archbishop William Lori has determined that to safeguard the well-being the faithful of the Archdiocese of Baltimore, all public Masses are canceled until further notice."
692,2020-03-14 23:06:54,ligma was way worse than corona virus
693,2020-03-14 23:06:51,Jared and his weird posse are the last people on Earth we should rely on! Jared Kushner’s ‘haphazard and helter-skelter’ coronavirus response revealed by The Washington Post - 
694,2020-03-14 23:06:36,"If you're wondering what Funkit Toys is doing to protect you from COVID-19, (you weren't) it's the same thing I've done the last four years: wash my hands and your dils with the knowledge and training of a food safety certified chef. Having no co-workers helps too."
695,2020-03-14 23:06:31,"What if those trunks Bey sent the clothes in are Corona proof? ...oh God, she protected who she wanted to. ...and I wasn’t included. "
696,2020-03-14 23:06:29,"Your stay-at-home, “I’ve done my research,” sales associate in a cheap makeup pyramid scheme, multiparous friend from high school, who has never left their home town, sharing their “extensive” knowledge of COVID-19 all over social media "
697,2020-03-14 23:06:29,It just so happens that @lou_deasis is starting his practicum with us this week. #yyc #yeg #coronavirus He also worked with #CSEC Though his practicum is supposed to be unpaid - we're going to pay him for this one. #justsayin
698,2020-03-14 23:06:27,"Taiwan has a population of 23 million. Last year, it had 2.7 million visitors from China. But as of March 10, Taiwan has just 45 coronavirus cases. Here's why the island has one of the best containment track records in the world so far: "
699,2020-03-14 23:06:25,BREAKING: Union officials confirm an OIA TSA officer tested positive for coronavirus. They tell me every worker in contact with that person has been notified. They’ve been worried about this because of the constant contact they have with passengers and their belongings.
700,2020-03-14 23:06:23,"A package that arrived at LAX from the United Kingdom was supposedly carrying purified water, but CBP officers found vials of white liquid labeled “Corona Virus 2019nconv (COVID-19)"" "
701,2020-03-14 23:06:09,"We have created a special section on our website for information on COVID-19. It includes instructional information for students, resources for families &amp; more. We will continually update these webpages so please check back often. https://newtoncountyschools.org/c_o_v_i_d-19_information #NCSSBeTheBest"
702,2020-03-14 23:06:08,wait if i get the coronavirus.... theoretically... .. would i lose weight?? ...like when you get the flu? haha just kidding! wouldnt want the coronavirus.... aha but like would i lose weight though
703,2020-03-14 23:06:05,Toilet paper and hand sanitizer aren't the only items popular among those stockpiling goods amid COVID-19 fears 
704,2020-03-14 23:06:00,And this moron sits in Parliament. I really struggling to accept that someone like Lavatory is in the position to vote on national legislation. #coronavirus 
705,2020-03-14 23:05:58,Gov. Ralph Northam on Saturday announced Virginia’s first death from the coronavirus 
706,2020-03-14 23:05:55,Coronavirus Has Turned The Canadian Children Angry https://www.barstoolsports.com/blog/2078159/coronavirus-has-turned-the-canadian-children-angry
707,2020-03-14 23:05:53,"Could someone please show the UK government these graphs?! China has proven that testing, quarantine, distancing and self isolation work and curtail the outbreak. Not mass exposure of 70% of the population to attain #Herd_Immunity but at what cost? #coronavirus #COVID19"
708,2020-03-14 23:05:53,#BREAKING An Australian man visiting New Zealand says he has tested positive for coronavirus and is now self-isolating in a Wellington hotel room. 
709,2020-03-14 23:05:45,"If you need 50 rolls of toilet paper to make it through the next 60 days, you don't have coronavirus, you have cholera."
710,2020-03-14 23:05:45,A handful of New Jersey and Pennsylvania movie theaters close down amid #coronavirus pandemic. More: http://cmplx.co/Yo7PILE
711,2020-03-14 23:05:40,DEEP DIVE: Coronavirus pushes U.S. airlines to the brink of some form of shutdown http://bit.ly/3aTVOuy #staycurrent #COVID19
712,2020-03-14 23:05:32,"As shoppers flock to big box stores amid the COVID-19 panic, small businesses are hoping consumers will support them during the pandemic. CityNews’ @BrandonRoweTV has more."
713,2020-03-14 23:05:27,"Splendid Saturday! We are in uncharted waters with the pandemic of COVID-19. If we all take steps to limit exposure and have patience as this crisis runs its course, that will go a long way to helping our whole community. Yes, we are working together! #StrongerTogether"
714,2020-03-14 23:05:19,So now the Corona Virus was started due to no Medicare for all? So glad @BernieSanders isnt using this crisis to pander for votes.
715,2020-03-14 23:05:18,if mick jagger gets the coronavirus and dies it’s single handily Lucas Jaggers fault 
716,2020-03-14 23:05:16,"This about to be me with my dog since he can’t get Coronavirus. Someone’s got to cook, clean, and work if I get it. TikTok cred: cliquelite "
717,2020-03-14 23:05:12,This is a great news! We do need nutrition for the soul in such a time. RT Coronavirus: The Metropolitan Opera to Stream Free Operas 
718,2020-03-14 23:05:08,"I'm right with Dorothy!! If ANYONE coughs, sneezes or breathes near me.. Wash your hands you filthy animals or you'll be staying #HomeAlone #Corona #CoronaVirus #GoldenGirls #TheGoldenGirls #BettyWhite #RueMcClanahan #BeaArthur #EstelleGetty"
719,2020-03-14 23:05:03,the wife of the president of spain has corona i-
720,2020-03-14 23:05:00,"No sports. And abundance of COVID-19 news. And then me. Hope it brought some joy to households across the nation. Thanks for the air time, @CBSNews. #OneLastTrip #GoDawgs"
721,2020-03-14 23:04:59,"CIA-Mockingbird MSM PROPAGANDA continues to try to DERAIL THE TRUMP TRAIN!!!! NBC Op-Ed Blames U.S. Freedom, Praises Communist China Over COVID-19 Response! https://www.infowars.com/nbc-op-ed-blames-u-s-freedom-praises-communist-china-over-covid-19-response/ #MAGA #Trump #Mighty200 #TWGRP #Qanon"
722,2020-03-14 23:04:51,when u get the corona and quarantined for 14 days :/
723,2020-03-14 23:04:44,asalamalaykum uncle with the corona virus going around i would like to marry your daughter so i can keep her safe in my home 
724,2020-03-14 23:04:42,I guarantee Trump is positive for coronavirus 
725,2020-03-14 23:04:40,"No joke. ""The coronavirus calamity should reach far &amp; wide. Coronavirus is paving the path for the emergence of the the last Imam,"" says a senior mullah in #Iran. Farsi source: https://bit.ly/39XFdWQ #COVIDー19"
726,2020-03-14 23:04:38,#BREAKING: Wife of Spanish Prime Minister Pedro Sanchez has coronavirus – PM's office 
727,2020-03-14 23:04:29,Evra was at United for 8 years and the medical stuff didn’t know he was allergic to eggs. Doubt they could spot Coronavirus 
728,2020-03-14 23:04:18,CAPITALISMO. Italians over 80 'will be left to die' as country overwhelmed by coronavirus 
729,2020-03-14 23:04:17,"Oppah was implying that us, Zimbabweans we're immune to COVID–19. Her remarks were not only ignorant but dangerous because people will actually stop taking precautions which is our only line of defence against the virus.Such words should be treated with the contempt they deserve!"
730,2020-03-14 23:04:17,Josh Gad Helps Kids and Parents amid Coronavirus Outbreak by Hosting Reading of Children's Book 
731,2020-03-14 23:04:07,"Despite covid-19 gathering speed in America, metro stations in New York are as busy as ever "
732,2020-03-14 23:04:05,"If you are feeling lost, like the messaging isn’t clear and you don’t know how to respond to coronavirus, just follow Dr Norman Swan, and note the urgency in his voice, he’s on the money. So many practical questions answered in this podcast: "
733,2020-03-14 23:04:03," BREAKING: RNC Chair Ronna McDaniel tested for #coronavirus , went to Trump's Mar-a-Lago, Senate lunch. Trump needs to #SelfQuarantine NOW! #COVIDー19"
734,2020-03-14 23:04:00,BREAKING: Goldberg has tested positive for being overrated. #Coronavirus
735,2020-03-14 23:03:49,I am a Hospice RN. My company has started requiring us to start our day at the office with a temp check. I'm not scared for myself-I am worried for my patients. The idea that I can be a carrier & transmit COVID for 3-5 days before I have symptoms terrifies me.
736,2020-03-14 23:03:38,#ResidentEvil #CodeVeronica #REBHFun Even Alexia Ashford is taking the necessary hygienic precautions to deal with Coronavirus. What’s your excuse? 
737,2020-03-14 23:03:38,"Because of the corona scare, all of their work is drying up and, for some, things are getting desperate. If they exit on a fan platform (our or any other), PLEASE consider helping them by subscribing and tipping them more than you would otherwise."
738,2020-03-14 23:03:37,Good to see the UK academic community finding their voice on the failure of the UK Government to protect the population from #COVID19 #coronavirus Scientists say UK virus strategy is 'risking lives' 
739,2020-03-14 23:03:31,"when nadal was trending, i thought Rafa Nadal had coronavirus #donttouchyourmouth"
740,2020-03-14 23:03:30,As part of our planned emergency measures we will be taking over control of all private hospitals. This is so we can make absolutely sure that no NHS patients get in. #coronavirus
741,2020-03-14 23:03:20,"If corona doesn't enter you, can I? "
742,2020-03-14 23:03:15,"People who don't care about getting #coronavirus because ""it's just, like, the flu"" imagine what will happen when hospitals are overrun, personnel are exhausted, there aren't enough space, beds or equipment &amp; people are sick, for a variety of reasons, and need medical attention?"
743,2020-03-14 23:03:12,Does anyone believe there are no cases of COVID-19 in West Virginia?
744,2020-03-14 23:03:09,Updated my COVID-19 resources with templates any teacher anywhere can use to support students. http://ftelearn.weebly.com/co-vid19.html #edtech #googleei #nyc19 #inelearn
745,2020-03-14 23:03:09,"I just called a hospital to inquire about coronavirus testing and the woman on the other end of the phone, in a strong Irish accent, was like “This is a pool. This is an outdoor pool.” That’s right, I called a local pool thinking it was the hospital. Everything is fine"
746,2020-03-14 23:03:03,"Ron Klain, who led the US response to the Ebola crisis, says the coronavirus pandemic will quickly overwhelm hospitals in the country. ""Many people often die not from the epidemic, but from the inability to get health care for other things."" https://on.msnbc.com/2UbnGn4"
747,2020-03-14 23:03:01,#Denmark rushes through emergency #coronavirus law! New law authorizes enforcement by any means necessary to gain compliance to include elimination of all medical freedoms as determined by the government. #covertagenda #Showdown
748,2020-03-14 23:03:00,"Clinics in Australia, South Korea, and Germany set up drive-thru coronavirus testing sites in attempt to slow the outbreak’s spread "
749,2020-03-14 23:02:54,"Surreal. “People just show up in the Oval and spout off ideas,” said a former senior administration official briefed on the coronavirus discussions. “He’ll either shoot down ideas or embrace ideas quickly. It’s an ad hoc free-for-all with different advisers just spitballing.” "
750,2020-03-14 23:02:29,"All you Guys and Dolls out there, @RandyRainbow has encapsulated our Lament. We are all Adelaide; make THIS go viral, not coronavirus! "
751,2020-03-14 23:02:29,Important info here. @nbcnews called every state health dept official. Coronavirus according to state health departments: 
752,2020-03-14 23:02:15,Ravers during the #coronavirus quarantine be like.... 
753,2020-03-14 23:02:13,"Coronavirus is most contagious before and during the first week of symptoms . ""after about 10 days or so, you’re not likely to be infecting other people"". Take home message - there is some reasoning now behind a 2 week isolation period. "
754,2020-03-14 23:02:10,Trump should take his #coronavirus test on live TV. It would be ratings gold. Tremendous ratings. 
755,2020-03-14 23:02:01,⁦@InsidersABC⁩ panel point to inconsistency in COVID-19 responses. ⁦@PhillipCoorey⁩ says national cabinet a good idea but ⁦@ScottMorrisonMP⁩ should include ⁦@AlboMP⁩ to depoliticise announced measures and unify the country.
756,2020-03-14 23:01:59,Does anyone know a good website to read lots of amateur opinions on the coronavirus?
757,2020-03-14 23:01:53,"Just so we’re clear, threat of coronavirus or not, jam packing yourself into a Wrigleyville bar with 5,000 other people to drink shitty green beer is a dumb idea every year."
758,2020-03-14 23:01:40,"stream the corona virus hits: toxic, work from home, the cure and hands to myself"
759,2020-03-14 23:01:40,I am so thankful for all of our dedicated and professional @HaltonPolice along with @haltonems @oakvillefire @BurlingtonFire @miltonfire8500 @HaltonHillsFD @HaltonMedics207 uniform and civilians working through the coronavirus situation to protect ALL.Thank You for your service
760,2020-03-14 23:01:39,Hey if we make it through this CoVid pandemic together let’s all agree to have a day where we wrap ourselves in our unused toilet paper and go outside pretending we’re all mummies.
761,2020-03-14 23:01:39,‘Big Short’ investor who cashed in on the financial crisis explains how he’s profiting from coronavirus ‘stampede’ 
762,2020-03-14 23:01:31,"#BREAKING Wife of Spanish premier Pedro Sanchez has coronavirus, according to official "
763,2020-03-14 23:01:23,"INBOX: Mayor Martin J. Walsh, Greater Boston Real Estate Board + property owners announce a partnership to impose a moratorium on evictions in Boston while Massachusetts is under a state of emergency. #bospoli #mapoli #COVIDー19 #coronavirus"
764,2020-03-14 23:01:21,"Wealthy Chinese businessmen are now sending aid to the US... like it’s a developing nation. What an incredibly fast power shift, all under one President. #COVID19 #coronavirus "
765,2020-03-14 23:01:21,"Solskjær: ""Would I let my family attend a football match during the coronavirus crisis? That’s not for me to answer. We just listen to the authorities and the bodies who decide. We just have to go with the decisions that are made."" #mulive [mirror]"
766,2020-03-14 23:01:18,"Cool, making jokes and kicking back with a beer instead of passing the emergency COVID-19 measure. Texas deserves better. "
767,2020-03-14 23:01:15,"Meanwhile, in Nicaragua, the government is promoting a big anti-coronavirus March. (The opposite of what experts recommend.) "
768,2020-03-14 23:01:14,"I am beyond disappointed to see hundreds / thousands of people congregating in Waterloo backyards today to drink in advance of St. Patrick's Day. COVID-19 is going to have drastic impact on our country, the economy, and the lives of many. People's ignorance is astonishing."
769,2020-03-14 23:01:11,"here's what's happening in Texas while @JohnCornyn sips his shots of beer - a law enforcement officer w coronavirus has been hospitalized, unconscious for days, fighting for his life. nice priorities, Senator. bottoms up. https://www.houstonchronicle.com/news/houston-texas/houston/amp/As-Patton-Village-officer-fights-coronavirus-15131723.php"
770,2020-03-14 23:00:48,Does anyone of my 48K followers know anyone that has the Infamous Coronavirus? Asking for a friend.....
771,2020-03-14 23:00:40,Trumps coronavirus team is MORE DIVERSE than the actual U.S. population Why are you BLANTANTLY LYING about the color of people skin? In your photo I see 2 black dudes a brown woman a white woman &amp; Trump @POTUS @realDonaldTrump @RealJamesWoods @seanhannity @TuckerCarlson
772,2020-03-14 23:00:36,There are those who will try to use #coronavirus for political gain Pay no attention - all MPs received the same brief from the Chief Medical Officer Be safe - follow the advice A global pandemic should be when political leaders put aside difference &amp; work for the common good 
773,2020-03-14 23:00:32,The coronavirus is being used as a political weapon to attack President Trump. Find out more on this episode of #BFT. https://buff.ly/2TM9Ngh
774,2020-03-14 23:00:28,Did someone already do “Will I really be able to appreciate COVID-19 if I haven’t already contracted COVIDs 1 through 18”?
775,2020-03-14 23:00:28, NEWT GINGRICH : I Am in Italy Amid the Coronavirus Crisis. America Must Act Now - “We should be planning for a worst-case pandemic and using the kind of intensity of implementation which served us so well in World War II.” 
776,2020-03-14 23:00:27,"Blood donations are plummeting as coronavirus cases continue to rise, raising the alarming possibility of a national blood supply shortage. The resounding message from blood banks: If you’re healthy, give blood now. "
777,2020-03-14 23:00:21,How are all of the store closures and everything thats on lockdown due to Covid-19 affecting freelance professionals? People still booking appointments ?
778,2020-03-14 23:00:17,WHO Warns Outbreaks In Victorian England Confirm Coronavirus Capable Of Spreading Through Time https://trib.al/q1mHzyv
779,2020-03-14 23:00:10,"Chinese billionaire and Alibaba co-founder Jack Ma said he will donate 500,000 coronavirus testing kits and one million face masks to the United States. "
780,2020-03-14 23:00:09,Hand-washing is critical to stop #coronavirus but even this most basic defense is out of reach for billions. Only 3 in 5 people worldwide have the basic hand-washing facilities they need to protect themselves from #covid19 and other diseases. v/@unicef @whoafro
781,2020-03-14 23:00:08,"Solskjær: “Our medical staff have been watching the [coronavirus] situation minute-to-minute. Even at half-time against LASK, we had the doctors checking on the players."" #mulive [mirror]"
782,2020-03-14 23:00:06,"150,000 immigrants from 72 nations with coronavirus stopped at border https://washex.am/2veGfhZ via @dcexaminer @SecretsBedard"
