,date,text
1287,2020-03-14 22:20:23,Fake coronavirus test kits seized at Los Angeles airport. 
1288,2020-03-14 22:20:19,I hope India is spared the havoc of coronavirus. But attempting to debunk Jim O’Neill on nationalistic grounds is a sign of hubris. O’Neill is wrong when he praises China for its draconian measures and disregards China for its secrecy which allowed the virus to flourish 1/n 
1289,2020-03-14 22:20:10,"“Some of us have worked in aviation through the global financial crisis, the Sars outbreak & 9/11. What is happening right now as a result of Covid-19 is more serious than any of these events. It is a crisis of global proportions like no other we have known” -British Airways CEO"
1290,2020-03-14 22:20:06,"Italy reports huge jump in Covid-19 cases to 21,000 + Health chiefs cited irresponsible behaviour by those who ignored warnings &amp; headed to beaches or ski resorts, &amp; gathered in town squares. http://rishExaminer.com https://www.irishexaminer.com/breaking-news/world/italy-reports-huge-jump-in-covid-19-cases-to-more-than-21000-987996.html"
1291,2020-03-14 22:20:05,New York is using low-wage prison labor to produce hand sanitizer as it fights shortages in the #coronavirus outbreak 
1292,2020-03-14 22:20:03,"Here's the latest on the coronavirus: --Spain is in lockdown, joining Italy --France is shutting its cafes --The U.S. is extending its travel ban to include the U.K. "
1293,2020-03-14 22:20:03,"Hours after NYC reported its first coronavirus death, a second death was reported in a northern suburb. "
1294,2020-03-14 22:19:59,"Already casual and contract/gig workers are losing work, especially in entertainment & tourism. All workers need support during #Covid_19. We need a minimum of two weeks special leave for everyone affected, for them &amp; the economy #insiders"
1295,2020-03-14 22:19:56,When the Coronavirus finds out that people are calling it the Wuhan Virus: 
1296,2020-03-14 22:19:46,"There's a lot of talk in the conspiracy sphere about the Wuhan biotech lab. But answer is, why would China infect itself on Chinese new year? Why were China & Iran first hit. Which lab do we know created a Coronavirus that crosses from bats to humans? "
1297,2020-03-14 22:19:45,Here is an update for the @NASA family on the agency’s response to coronavirus (COVID-19): https://blogs.nasa.gov/bridenstine/2020/03/14/update-on-nasas-response-to-the-coronavirus/
1298,2020-03-14 22:19:45,"You're right @vanOnselenP It IS irresponsible of @ScottMorrisonMP He failed on leadership during the bushfires, now he has failed on leadership during #coronavirus Morrison is NOT fit to lead. Full stop. #auspol #Insiders"
1299,2020-03-14 22:19:33,"Since the first case was confirmed in Spain on January 31, an average of 146 people a day have been infected with coronavirus — now the country is on lockdown https://cbsn.ws/2xEmmlf"
1300,2020-03-14 22:19:20,So what a (hu)man gotta do? What a (hu)man gotta do? To not get covid-19? What a (hu)man gotta say? What a (hu)man gotta pray? To make sure corona virus stays away? 
1301,2020-03-14 22:19:17,"Hi Twitter. This is Henry's only Friend. A little bit ago he was quarantined in a holding cell unable to contact anyone. To our dismay, it wasn't coronavirus that he tested positive for but the possession of the fattest fucking ballsack in human history."
1302,2020-03-14 22:19:12,Corona working overtime to remind me how single I am
1303,2020-03-14 22:19:09,"Tightness in Chest, a Mild Cough and soreness in throat. I'm jittery, and my energy level is low. However, I have no fever. It can't be Corona, I'm just a gamer."
1304,2020-03-14 22:19:08,"Immune affected folks please take note “Anti-inflammatories may aggravate Covid-19, France advises. French minister says patients should take paracetamol rather than ibuprofen or cortisone” "
1305,2020-03-14 22:19:06,Christians who aren’t meeting with one another to worship in small groups to watch online services because the fear of getting coronavirus: Ask yourself where your heart is. i think there’s a difference between being responsible + cautious vs being enslaved with fear.
1306,2020-03-14 22:19:04," What would happen if the #coronavirus would be visible, for instance, that each carrier of the virus would turn green, pink, or purple. The streets would briefly be jolly colorful, and then be deserted. The virus would soon feel as quarantined as we should be. RT #alexnote"
1307,2020-03-14 22:18:58,"But @realDonaldTrump is a racist and a xenophobe Interesting Guatemala bans arrivals from U.S., Canada to fight coronavirus | Article [AMP] | Reuters "
1308,2020-03-14 22:18:57,"Staples Center tenants announce a fund to aid the 2,800 hourly workers affected by cancellations due to coronavirus "
1309,2020-03-14 22:18:28,Guatemala City’s Casa de Migrante is shutting down for COVID-19. That shelter is where Honduran and Salvadoran asylum seekers are sent after the US deports them there under the Safe Third Country deal/Asylum Cooperative Agreement. The US must immediately suspend the agreement. 
1310,2020-03-14 22:18:25,"Several teachers and librarians have contacted me, asking for permission to shoot and post videos of themselves reading my books for their students while their school is temporarily closed due to the coronavirus. The answer is YES YES YES! I love it! Please do!"
1311,2020-03-14 22:18:15,"Unless John Bolton is still seeing classified information, there’s no way for him to say whether or not disbanding the NSC’s global health & security unit has hampered the US response to #coronavirus. He knows this, but apparently he’s hoping you don’t. "
1312,2020-03-14 22:17:54,"Israel has further tightened coronavirus restrictions, including limiting gatherings to 10 people and closing all leisure and entertainment venues effective Sunday morning. "
1313,2020-03-14 22:17:53,Liberals are still far more of a pain in the ass in this Country than this CoronaVirus #COVIDー19 #CoronaVirusUpdates #ThingsYouShouldHoard
1314,2020-03-14 22:17:53,"F**K her - she helped spread Trump's lies that the Coronavirus was a Dem hoax, that will lead to (100s of?)THOUSANDS of dead Americans. Again F**K HER. "
1315,2020-03-14 22:17:52,"BREAKING: The Premier League are investigating finishing the season between July and September, truncating the 2020-2021 campaign, in order to solve the many problems caused by the Coronavirus. [@Independent]"
1316,2020-03-14 22:17:51,"Just heard from a defender in a California county. A judge presiding over in custody misdemeanors on Friday, in light of COVID-19, gave credit for time served, dismissed cases in the interests of justice, and ordered release. All w/in the judge's power to do. More of this."
1317,2020-03-14 22:17:49,imagine for some reason u didn’t know about coronavirus and u walked out and all the streets and supermarkets are empty
1318,2020-03-14 22:17:44,KDKA reporting 100-200 people held a private St. Paddy’s Day parade where groups walked parade route with a police escort even though the event was canceled due to coronavirus. Can’t believe hundreds of grown adults couldn’t just take the L to support public health. 
1319,2020-03-14 22:17:40,"Alex Rae has went full looney in the past 12 hours or so, he's no far away from showing up in Italy way a fishing rod and a cooked chicken claiming to be a friend of coronavirus."
1320,2020-03-14 22:17:39,Many of us are asking how we can meaningfully contribute to #COVID19 efforts as medical students. Sharing an initiative I'm leading @HarvardMed: the COVID-19 Health Literacy Project. There has been a real lack of accessible health information available in different languages.
1321,2020-03-14 22:17:39,Putin signs constitutional change seeing him run for president again This shit right here will panic more dems than Coronavirus! Somebody check on Herman! https://mol.im/a/8112007
1322,2020-03-14 22:17:35,Everyone who stayed home tonight #coronavirus #COVID19 #COVIDー19 #CloseThePubs
1323,2020-03-14 22:17:29,"UVA hospital (and most others I’d assume) are frequently at or near capacity during normal conditions. And it’s not like people are going to stop having heart attacks, strokes, etc. It won’t take very many coronavirus patients to overwhelm a hospital. #SocialDistancing"
1324,2020-03-14 22:17:22,"I very rarely block, but if someone is trying to spread unscientific nonsense and conspiracy theories in connection with the coronavirus, through my feed in replies to me, they will be blocked. This is not the time to play games."
1325,2020-03-14 22:17:15,My friend Alba just went off on this Mask hoarder. When the dust settles I hope we do something as a society to make it abundantly clear that this is not acceptable. #coronavirus #Corvid_19 #COVID19Vancouver #vanpoli #vancouver #bcpoli
1326,2020-03-14 22:17:12,Happy Birthday Guilfoyle. Mar a Lago is Ground Zero for #coronavirus in Florida. 
1327,2020-03-14 22:17:12,This is the attitude of the @SenateGOP and @JohnCornyn on particular to a #coronavirus pandemic that is currently killing Americans. Calling Cornyn an a$$hole is an insult to a$$holes. #RussianAsset.
1328,2020-03-14 22:17:11,rappers making songs about corona virus think they are marketing geniuses
1329,2020-03-14 22:17:09,BREAKING: Georgia to delay presidential primary due to coronavirus pandemic #gapol https://www.ajc.com/news/state--regional-govt--politics/georgia-delay-presidential-primary-due-coronavirus-pandemic/0vJZpHlHdPQdPEda6GtvCP/
1330,2020-03-14 22:17:07,"I really hope the coronavirus situation ends before Ramadan. So everyone can spend time with their loved ones in peace. May Allah accept our duas and forgive us all. He will always want the best for us. 40 days till Ramadan, Insha’Allah "
1331,2020-03-14 22:17:00,"All these commercial interests complaining about taking a hit because of Corona virus, have been paying out lavish dividends to their shareholders for years. Now is the time for those shareholders to pay money back into the industry that has served them so well!"
1332,2020-03-14 22:17:00,British media peddles #fakenews and scare stories on #coronavirus outbreak in #Iran
1333,2020-03-14 22:16:47,The coronavirus news has me all down and gloomy. Nothing could possibly cheer me u- 
1334,2020-03-14 22:16:38,"Do not call or attend GP Out of Hours for COVID-19 testing, it is not available at these settings. If you have symptoms call your own GP on Monday. Please only dial 999 in an emergency. Check http://www.hse.ie for information. #Covid19"
1335,2020-03-14 22:16:34,"The COVID virus lives for 4 hours max on copper vs. 3 days on steel and plastic and 24 hours on cardboard, so it's come to this. "
1336,2020-03-14 22:16:34,This is basically if Taylor Sheridan made a Neo-Western about Coronavirus. 
1337,2020-03-14 22:16:33,Chuck Norris tested positive for Coronavirus. The virus was quarantined for 14 days.
1338,2020-03-14 22:16:23,I just want to make sure everybody knows and acknowledges that the @BostonGlobe still has its paywall up on #coronavirus stories. The fact that subscribers aren't demanding for it to come down shows that they feel the same way about the community at large as Globe management. 
1339,2020-03-14 22:16:21,Greens call for Coronavirus Solidarity Pact | The Green Party https://www.greenparty.org.uk/news/2020/03/14/greens-call-for-coronavirus-solidarity-pact/ This is a compassionate and reasoned position which ought to be adopted immediately @SheffieldGreens @YHGreenParty
1340,2020-03-14 22:16:13,United 20 Covid 19 Lfc 18 
1341,2020-03-14 22:16:11,Covid-19 PDP -16 They are both virus...
1342,2020-03-14 22:16:10,no corona here queen shit pic.twitter.com/WsRumUwEdk
1343,2020-03-14 22:16:08,"Hundreds of people lined up to buy supplies at a #costco store in Novato, CA. The line snaked around the building and continued to grow before they opened the doors. #COVID19 #coronavirus "
1344,2020-03-14 22:16:07,BREAKING: Disneyland College Program Comes to an End as Disneyland Closes Due to Coronavirus https://wdwnt.news/20200314020
1345,2020-03-14 22:16:04,"Why outbreaks like coronavirus spread exponentially, and how to “flatten the curve” "
1346,2020-03-14 22:15:59,Labour urges government to let people affected by coronavirus defer their rent payments 
1347,2020-03-14 22:15:59,The ABC has a dedicated #coronavirus website with information from health authorities and the latest @abcnews coverage. Please use it: http://ab.co/3b5L6kX
1348,2020-03-14 22:15:53,"My thanks to @LSUfootball's Coach O for doing his part to keep Louisianians healthy &amp; safe as we all tackle the #coronavirus together. Let's all be team players and follow his game plan: Cover your cough w/ your elbow Wash your hands If you're sick, stay home #GeauxTigers"
1349,2020-03-14 22:15:41,"Yes! We stand together in this public health emergency. Compassionate, Responsible, United #coronavirus "
1350,2020-03-14 22:15:30,How we know Trump was lying when he said ‘I didn’t do it’ and ‘I don’t know anything about’ closing the pandemic office #coronavirus 
1351,2020-03-14 22:15:26,"Israel to shut malls, restaurants, hotels to counter coronavirus https://reut.rs/2Qh8IuL"
1352,2020-03-14 22:15:25,Ontario limits who can be tested for COVID-19 due to demand for nasal swabs https://www.ctvnews.ca/health/coronavirus/ontario-limits-who-can-be-tested-for-covid-19-due-to-demand-for-nasal-swabs-1.4853260?taid=5e6d577d72e8fa00012bf46a&amp;utm_campaign=trueAnthem%3A+Trending+Content&amp;utm_medium=trueAnthem&amp;utm_source=twitter
1353,2020-03-14 22:15:15,"If you have symptoms such as cough, fever, fatigue or difficulty breathing, a new, online self-assessment tool can help determine if you should be tested for COVID-19. Help keep Health Link free for those who need it. Learn more: https://myhealth.alberta.ca/Journey/COVID-19/Pages/COVID-Self-Assessment.aspx"
1354,2020-03-14 22:15:15,Today there were 150 cars in the parking lot of a gym not 5 miles away from a Seattle hospital swamped with COVID patients 
1355,2020-03-14 22:15:13,London's homeless handed coronavirus health packs by volunteers 
1356,2020-03-14 22:15:11,Makati City resident tests positive for COVID-19 
1357,2020-03-14 22:15:09,"FL Health Dept. says a 77 year old in Lee County who tested positive for COVID-19 has died. This was not a travel-related case, the state says."
1358,2020-03-14 22:15:07,Is coronavirus the end of the handshake? 
1359,2020-03-14 22:15:04,Students are expressing a range of opinions—and emotions—as colleges and universities across the U.S. take action to help contain the spread of the coronavirus 
1360,2020-03-14 22:15:04,I visited some of the tougher areas of Georgia’s District 5 today to make sure that some of our forgotten citizens were equipped for the #coronavirus pic.twitter.com/m95peWsZNT
1361,2020-03-14 22:15:00,Coronavirus info sheets spread by local authorities in northeast Syria 
1362,2020-03-14 22:14:59,"""I would have thought for the sake of sending the right message to the community - the Cabinet, the Prime Minister, and certainly, the Chief Medical Officer, should be on the more prudent, cautious, conservative side,"" @vanOnselenP on CMO's advice. #Auspol #Coronavirus #Insiders"
1363,2020-03-14 22:14:59,Coronavirus take me now 
1364,2020-03-14 22:14:55,i have put together a list of people who CANNOT get covid-19 by any means and must be protected at all costs 1. hayley williams 2. jenna marbles 3. all the people who are getting kicked out of college and those who can’t afford to get treated 4. bernie sanders 5. tony hawk
1365,2020-03-14 22:14:51,Overheard at a bar: “The media said nothing when it was swine flu. Nothing. Now it’s a big deal.” The experts tell us #coronavirus is a big deal. I’m inclined to believe science over some blowhard on a barstool.
1366,2020-03-14 22:14:34,"Our team, led by @juliaheather @clarewenham and @RosemaryJMorgan, received word from @CIHR_IRSC yesterday of a new grant to take this critical work on #gender and #covid forward. We will now be conducting 2 studies, on the IHR and gender, to strengthen global outbreak response. "
1367,2020-03-14 22:14:31,"This is what I've been saying. (No one listens to me) Go back 6-8 weeks, how many of every pneumonia death was coronavirus.... USA, the greatest country on earth, has NO FUCKING CLUE how far and wide this has spread. We're about to find out... the hard way. "
1368,2020-03-14 22:14:26,The UK and US currently have very irresponsible leadership and their responses to Coronavirus are a reflection of their irresponsibility.
1369,2020-03-14 22:14:21,Do you have a question about the Coronavirus on how to keep you and your family safe? Reply with your questions and it may just be answered by @DrMarcSiegel on ‘Justice’ tonight.
1370,2020-03-14 22:14:11,Over half of the coronavirus patients in intensive care in the Netherlands are under 50 years old h/t @Momo_x5x
1371,2020-03-14 22:14:06,"If you’re a patient/doctor/health care provider in Virginia and can’t get testing for COVID-19, I (the health reporter for @MercuryVirginia) want to hear from you. You can DM or email me at kmasters@virginiamercury.com. My inbox is open for all other coronavirus-related stories."
1372,2020-03-14 22:14:04,"This can’t possibly be true @TurnKeyVR, can it? Here’s an idea... allow this senior citizen to cancel their reservation w/o penalty and lose a few bucks or let us folks on Twitter make sure your business is no longer viable after the #Coronavirus. Your call. cc: @TheTNHoller"
1373,2020-03-14 22:14:00,There are millions of Americans who live paycheck to paycheck and don’t have paid sick leave. A pandemic is not the time for partisan politics. Universal paid sick leave must be passed immediately to stop COVID-19 from spreading and save lives. 
1374,2020-03-14 22:13:57,I produced a video explaining why people don't need to panic over the Corona Virus and YouTube demonized it and restricted it's distribution. Of course. Because @YouTube is run by morons. https://youtu.be/Vr93jnjMqEY
1375,2020-03-14 22:13:56,"Coronavirus causes KFC to pull its Finger Lickin' Good ads ""It doesn’t feel like the right time to be airing this campaign, so we’ve decided to pause it for now"" "
1376,2020-03-14 22:13:54,"Thank you coronavirus,very cool. "
1377,2020-03-14 22:13:53,Stephen King called attention Friday to the number of white men gathered with President @realDonaldTrump addressing the Wuhan #coronavirus. DEMOCRATS ARE CONSUMED WITH RACE AND GENDER. SAD #COVIDー19
1378,2020-03-14 22:13:52,corona virus can’t kill me ‘cause I already died when this scene happened 
1379,2020-03-14 22:13:51,"Tomorrow 8pm EST, Bernie and Biden will finally debate Bernie is the only candidate with the vision, fight, and working class solidarity to deal not just with the Corona pandemic but with the economic crisis that will follow. We’re all stuck at home, so watch the damn debate "
1380,2020-03-14 22:13:50,He looks like coronavirus
1381,2020-03-14 22:13:39,"The Coronavirus outbreak will spread rapidly throughout the UK, gaining thousands of new cases and it will result a in lockdown. Schools and businesses will close."
1382,2020-03-14 22:13:35,Wait... didn’t Trump Touch and talk closely with a bunch of people after he was exposed to at least two people with coronavirus? This seems odd… 
1383,2020-03-14 22:13:30,"Maths and physics students have absolutely no business being equated to the epidemiologists, virologists and biologists working on the government response to Covid-19. Amazingly bad reporting. "
1384,2020-03-14 22:13:24,One of my main goals during coronavirus coverage is to get your questions answered. Today @foxandfriends I did several segments where I was able to bring viewer questions directly to our team of doctors and get those questions answered.
1385,2020-03-14 22:13:17,Beaumont Royal Oak starts curbside testing for coronavirus https://www.detroitnews.com/story/news/local/oakland-county/2020/03/14/beaumont-royal-oak-starts-curbside-testing-coronavirus/5051591002/ via @detroitnews Story by ⁦@SarahRahal_⁩
1386,2020-03-14 22:13:17,People have asked me a confirmation if the singing was a joke. It totally wasn't. I worked months to acchieve that. And today I am proud to present my new song about lighnings: This is Finland during Covid19. #covid19 #coronavirus #Finland #Helsinki
1387,2020-03-14 22:13:10,"""Almost everyone gets a coronavirus infection at least once in their life, most likely as a young child. In the United States, coronaviruses are more common in the fall and winter, but anyone can come down with a coronavirus infection at any time."" "
1388,2020-03-14 22:13:00,"Our last night together before she heads to Carlow to her lovely sister ⁦@TheEldestRock⁩ for the duration, she will have the best time, I won’t have to miss work, I’m relieved and very very lucky, my girls are the people I wish I was more like #nurselife #covid_19 "
1389,2020-03-14 22:12:56,"#3 in this thread involved an infuriating autocorrect error! This should read RIBOVIRUS, not rhinovirus. Both COVID-19 and 1957 flue are riboviruses. Influenza A is Riboviria, Phylum: Negarnaviricota, and Coronavirus is Riboviria, Phylum: incertae sedis. 22/"
1390,2020-03-14 22:12:51,Just like that 5 years of med school is over.Without goodbyes or grad ceremony in the foreseeable future. Final exams to be completed online. #Covid changed everything - safe travels to my friends &amp; classmates returning to their homes hope we are reunited soon. #classof2020
1391,2020-03-14 22:12:43,"If the media said building a wall would prevent the spread of the Coronavirus, we would see a wall from San Diego to Miami in 30 days."
1392,2020-03-14 22:12:35,"#Coronavirus fatalities in 175 cities in Iran exceeding 4,500 @Maryam_Rajavi: Not releasing prisoners is a great crime against humanity for which Khamenei is responsible, the world should intervene #COVIDー19"
1393,2020-03-14 22:12:26,Literally my work’s Coronavirus protocol. #COVID19 #COVIDー19 
1394,2020-03-14 22:12:20,"#BREAKING: @HealthyFla announces a 77-year-old COVID-19 patient from Lee County has died. ""Not a travel-related case,"" the department says."
1395,2020-03-14 22:12:18,magic johnson gotta be immune to coronavirus. aids gonna cancel that shit out like PEMDAS
1396,2020-03-14 22:12:18,"Scientists created a #coronavirus that crosses from Bats-to Humans in 2015, North Carolina. #COVIDー19 https://www.sciencedaily.com/releases/2015/11/151110115711.htm"
1397,2020-03-14 22:12:15,"Stacy: OMG Jennifer, remember when we went out for yer bachelorette party during that corona beer virus thing and all our grandparents like, literally, died. Soooo cray cray. Narrator: And that day a millennial finally learned how to use the word “literally” correctly."
1398,2020-03-14 22:12:13,Meanwhile 40 Republicans voted no on coronavirus spending bill 
1399,2020-03-14 22:12:12,@LeoVaradkar @simoncoveney @MichealMartinTD @PresidentIRL Please close the pubs. I am a nurse working in the middle of this. An insult to everything we do. #coronavirus #StayAtHome #CloseThePubs
1400,2020-03-14 22:12:05,MSDH lab team running COVID-19 tests live shot 
1401,2020-03-14 22:11:58,"Dear Friends... As COVID-19 spreads and the safety concerns around large group gatherings increases, we will say what we never thought was possible - we will stop screenings at 7 Ludlow Street for the time being. The Commissary will remain open: http://ow.ly/ZXgS50yLVDp"
1402,2020-03-14 22:11:56,Many things have been cancelled because of the coronavirus. Love is not one of them. https://www.americamagazine.org/faith/2020/03/13/faith-time-coronavirus #coronavirus #COVIDー19
1403,2020-03-14 22:11:55,"With the world is facing a #coronavirus catastrophe, you'd think nations would put geopolitics aside, but no, the U.S and many other of its poodles continue to sanction the life out of #Iran, one of the worst affected countries."
1404,2020-03-14 22:11:47,"Just spoke with a pastor, we find it ironic/hypocritical that those complaining about churches being cancelled b/c of #coronavirus are often those who easily skip church for youth sports, being hungover, an NFL game, their college football team lost, rain, brunch...whatev!"
1405,2020-03-14 22:11:46,Corona virus linking up with malaria and cholera in Sudan 
1406,2020-03-14 22:11:46,"House Democrats took decisive action by passing the #FamiliesFirst Coronavirus Response Act to help ensure the safety and security of every American. As @TeamPelosi now sends our bill to the Senate, one question looms large over Washington: #WheresMitch?"
1407,2020-03-14 22:11:45,Tutorial on how to stay safe off the Corona Virus by A.C.E Step 1: Throughly wash your hands Step 2: Sanitize Step 3: Dab while you sneeze (This whole procedure works better if you stan A.C.E. So be safe from the Corona Virus and stan A.C.E) 
1408,2020-03-14 22:11:42,This staying in the house shit ain’t it. Corona has me not even wanting to be an introvert anymore. I’m bouta start overstaying my welcome soon as this shit passes. I can’t wait to be annoying.
1409,2020-03-14 22:11:38,The party that just tried to use the #coronavirus funding bill to sneak in abortion funding is now pretending like they really care. You should be on the phone telling @TeamPelosi to stop playing politics with American lives.
1410,2020-03-14 22:11:24,I get it. Comedy clubs are staying open so they can continue to pay their bar and wait staff. But imagine getting corona because you went to see Jeremy Piven do stand up.
1411,2020-03-14 22:11:24,Mutes the word Coronavirus. Twitter goes ghost.
1412,2020-03-14 22:11:07,"I'm today announcing additional steps to slow the spread of COVID-19 in our city. Effective immediately, all 17 @LFPL locations will be closed. We’re taking this difficult step to protect the health and safety of our library staff and our library patrons. 1/5"
