,date,text
1790,2020-03-14 21:45:22,Al Sharpton just asked Rep. Marcia Fudge on MSNBC how Joe Biden would have handled the #Coronavirus differently than @realDonaldTrump. Rep. Fudge couldn’t think of a single example. Maybe that’s because...
1791,2020-03-14 21:45:18,"Ladies and gentleman, 10yo has just made up a joke. Please let him know how funny you found it. Be kind, he’s 10! Which composer got the coronavirus? DryCoughsky "
1792,2020-03-14 21:45:10,Italian journalist urges UK and US to lockdown NOW amid coronavirus pandemic 
1793,2020-03-14 21:45:04,"With the Premier League suspended because of coronavirus, Liverpool’s fans fear their 30-year wait for a title might never end "
1794,2020-03-14 21:45:02,"80. All full of applause for healthcare workers: Hortaleza, Sant Andreu, San Sebastián, Murcia, Cartagena, Seville. The whole country against Coronavirus. "
1795,2020-03-14 21:45:01,"For my fellow extroverts in the time of COVID: It looks like Zoom has nixed the 40-minute limit for free accounts right now! I’m scheduling happy hours with my friends, highly recommend doing the same to stay connected and support each other. Sign up: "
1796,2020-03-14 21:44:59,OH: I’m waiting for Trump to say he has the highest score on his COVID test.
1797,2020-03-14 21:44:53,I'm surprised no one's written the hot hot take on how freaking out about Corona is a sign of white privilege because people of color and folks from developing countries and conflict zones have to live with the fear of being killed every day
1798,2020-03-14 21:44:50,LMAOO TRUMP TESTED POSITIVE FOR THE CORONAVIRUS https://worldhealthwebsite.now.sh/donald-trump-virus
1799,2020-03-14 21:44:44,To combat the spread of corona I am petitioning the powers that be to immediately release the following: Narcos: Mexico - season 3 Sucession - season 3 Justice League - The Snyder Cut You - season 3 Game of Thrones alternate finale RT to sign the petition/comment other requests
1800,2020-03-14 21:44:44,"Arizona AG persuades a judge to kill plan to mail ballots for March 17 Dem primary. Voting by mail would've slowed the spread of the coronavirus, which thrives in long slow lines of people. Should we call AG Mark Brnovich of @GOP pro-coronavirus?"
1801,2020-03-14 21:44:42,"There is concern in border counties like Donegal over the difference in approach by authorities to Covid-19, particularly in relation to the closure of schools "
1802,2020-03-14 21:44:41,"⑫ We, South Korea, must reassess our strategy to fight a long battle against Covid-19. "
1803,2020-03-14 21:44:38,Promising start. A human monoclonal 1 antibody blocking #COVID-19 infection 
1804,2020-03-14 21:44:28,"NEW: Kushner saw the admin floundering in its coronavirus response and inserted himself. He called execs to expand testing - but Trump’s big announcement Friday was only half baked. The latest inside the response, w/ @AshleyRParker @PhilipRucker @jdawsey1"
1805,2020-03-14 21:44:19,"PLEASE SHARE: As #covid19 cases increase, each of us can work to help slow transmission in our communities. Protective measures help #FlattenTheCurve, so the total number of cases are spread over a longer time period, allowing hospitals to care for all who need it. #coronavirus "
1806,2020-03-14 21:44:18,"Thank God Congress spent crucial weeks Impeaching Trump while we witnessed China getting hammered by the #CoronaVirus -- Our so-called leaders would be fired in the private sector. These are not bright people, certainly not honest. Should have planned, prepared, Instead? Grab A$$"
1807,2020-03-14 21:44:05,WVa remains only state without confirmed COVID-19 case | WTRF https://www.wtrf.com/news/west-virginia-headlines/wva-remains-only-state-without-confirmed-covid-19-case/
1808,2020-03-14 21:44:00,The North Carolina Department of Public Instruction received a waiver that will allow schools to provide meals to economically disadvantaged children during coronavirus closure. 
1809,2020-03-14 21:44:00,"Most Republicans don't think a coronavirus outbreak will happen in their area (52% a little/not likely) and they are not concerned about it (74% a little/not concerned). Compare to Democrats: 78% think an outbreak is likely, and 67% are extremely/moderately concerned about it."
1810,2020-03-14 21:44:00,"My heart goes out to the family of the first Virginian to die of COVID-19. We've had 11 more case confirmed since yesterday. Visit the link below for more info. For my constituents who subscribe to my newsletter, please check your email from yesterday. http://www.vdh.virginia.gov/surveillance-and-investigation/novel-coronavirus/"
1811,2020-03-14 21:43:54,Chinese Tycoon Who Criticized Xi’s Response to Coronavirus Has Vanished 
1812,2020-03-14 21:43:49,"My sister traveled internationally in January. Came back and had and got very sick, tested negative for the flu, and a week later got pneumonia. Our whole family now thinks she probably had COVID-19."
1813,2020-03-14 21:43:45,"#coronaUK #coronavirus Dear @GOVUK Polite but urgent request to please: - appoint a spokesperson, dedicated to this national emergency - commit this person to deliver daily press conferences - ensure utmost transparency and do NOT drip feed certain journalists ('sources')."
1814,2020-03-14 21:43:31,We have put together an emergency mutual aid fund for cinema employees affected by COVID-19. We need to all take care of each other right now; please give and share. 
1815,2020-03-14 21:43:29,"Anti-inflammatories may aggravate Covid-19, France advises "
1816,2020-03-14 21:43:25,Coronavirus: Do that lil dance and you’re safe Me: 
1817,2020-03-14 21:43:23,The NY subway in times of #coronavirus 
1818,2020-03-14 21:43:20,what my dad sends to the group chat during the corona outbreak 
1819,2020-03-14 21:43:17,BREAKING: Chief Medical Officer of Health Dr. Janice Fitzgerald announces first presumed case of COVID-19 in Newfoundland and Labrador 
1820,2020-03-14 21:43:15,"here's what's going on in Texas while @JohnCornyn sips his shots of beer: local law enforcement officer is in hospital w #Covid_19 - fighting for his life, unconscious for days. great priorities, @TeamCornyn - bottoms up. Folks, please vote for the adult in the room - @mjhegar"
1821,2020-03-14 21:43:10,Haitian women rather catch Corona than feelings
1822,2020-03-14 21:43:09," 1st #coronavirus case in Orange County #Florida is a man who attended a Mar-a-Lago brunch–not clear if @realDonaldTrump attended. Mar-a-Lago should be designated a #COVID19 hot zone, and its members/visitors quarantined. @thespybrief ht @Agenthades1"
1823,2020-03-14 21:43:01,"Pres. Trump has suspended campaign events amid the novel coronavirus pandemic—and now his campaign and the RNC are shifting all current events on the schedule online, officials tell @ABC News."
1824,2020-03-14 21:43:00,"From conspiracy theories about its origin to bogus ‘cures,’ here’s the misinformation to avoid about the global coronavirus outbreak "
1825,2020-03-14 21:42:51,"Yesssssssssssssssssssss!!! . Posted withregram • @ryantedder Covid’s bout to get CLAPPED!!!!!!! @Austin, Texas https://www.instagram.com/p/B9usOe0FaXp/?igshid=jakipgknzb0z"
1826,2020-03-14 21:42:41,A Texas police officer in his 40s is in critical condition after testing positive for the coronavirus 
1827,2020-03-14 21:42:27,The airline industry needs to pay tax on its fuel and downsize until such time as it can demonstrate an alternative pathway to net zero emissions. Any temporary bailout because of coronavirus must be conditional on the recipient accepting these realities.
1828,2020-03-14 21:42:24,"just saw a tweet how rapunzel was quarantined in her tower, and the kingdom in tangled is called corona... "
1829,2020-03-14 21:42:16,It’s a tough/lonely time for many... - Coronavirus Scare - No Sports - Gloomy/Bad Weather - Social Distancing FaceTime a friend who you know is suffering and has depression or could be lonely. Cheer someone up and let them see you. Make them smile! We are all in this together
1830,2020-03-14 21:42:07,"Bernie Sanders is peddling pure Socialism ... Venezuela style. The COVID-19 pandemic has left shelves bare ... because we don’t know what to expect. With Bernie or Biden as pres, we KNOW exactly what to expect ... panic, chaos &amp; bare shelves. Don’t away! "
1831,2020-03-14 21:42:05,"This ⁦@PardonMyTake⁩ episode will probably educate more young American men about risk from #coronavirus than any TV network or newspaper. We need more actors, comedians, singers to communicate directly to their fans this way. Especially young ones. "
1832,2020-03-14 21:42:01,Courtesy of my Grampa: Ya know where ya can’t get infected with COVID-19? Fishing. Ya know what doesn’t have COVID-19? Fish.
1833,2020-03-14 21:42:00,"We're very concerned about how the COVID-19 pandemic will affect people in countries with already fragile health systems. A new page on our site provides you access to our latest #COVID19 updates, take a look:"
1834,2020-03-14 21:41:48,#Trump World Descended On Mar-a-Lago as It Became a Coronavirus PETRI DISH #MaralagoVirus’s KARMA Social media posts reveals that a startling number of the president’s allies may have been exposed #MOG #BlueWave2020 #MAGA 
1835,2020-03-14 21:41:47,"If you survived 5 minutes in this building in Tuscaloosa, then you’re immune to the Coronavirus "
1836,2020-03-14 21:41:44,"The fact that we can literally see into the future at what coronavirus will do (China, Italy, France) and US citizens are just acting like it'll be ok is just....AMERICA ESPLAIN!!! "
1837,2020-03-14 21:41:44,"Move over bitcoin, seems toilet paper is the new currency. #CoronaVirus #CODVID19"
1838,2020-03-14 21:41:42,When antisocial people see #StayHome trending #coronavirus 
1839,2020-03-14 21:41:36,"In the latest sign of the apocalypse, the ⁦@washingtonpost⁩ has just launched a page for the specific purpose of tracking ⁦@realDonaldTrump⁩’s lies about the coronavirus. "
1840,2020-03-14 21:41:35,"Israel has further tightened coronavirus restrictions, including limiting gatherings to 10 people and closing all leisure and entertainment venues effective Sunday morning https://cnn.it/33gxUqC"
1841,2020-03-14 21:41:30,My heart too... This is why I'm a proud British Muslim Islamic values inspiring this Muslim couple in Scotland to prepare 'Corona virus packages' &amp; distribute them for FREE of charge to older people We are in this together That's how we promote community cohesion 
1842,2020-03-14 21:41:25,At least 6 people who traveled to the US with Bolsonaro have the new coronavirus. 
1843,2020-03-14 21:41:23,Omg we stan the coronavirus even harder now 
1844,2020-03-14 21:41:10,"With everyone being told to stay home, I predict a babyboom around Christmas time. 5 years from now we'll have a generation of girls named 'Corona' entering primary school."
1845,2020-03-14 21:41:06,"Coronavirus testing in South Korea: 1. Drive to a testing station 2. Stay in your car 3. It takes less than 10 minutes 4. Results texted to you the next day Done. Oh, and it's free."
1846,2020-03-14 21:40:48,"As the WHO designated the coronavirus a pandemic, Jared Kushner saw the White House floundering and inserted himself at the helm of its response "
1847,2020-03-14 21:40:47,"Would be better positioned to ramp up production of needed coronavirus essentials (masks, hand sanitizers, medications and medical devices) had we not offshored so much industrial capacity (and the know-how that goes with it). We're not the country we were during WWII."
1848,2020-03-14 21:40:43,"Allah has revealed something about ourselves during this #coronavirus pandemic. This crisis has exposed the selfishness some of us have in our hearts. As some of us hoard months worth of essentials, take a moment and reflect on how you might be depriving someone in need."
1849,2020-03-14 21:40:27,"Shairi in the time of Covid virus. Who would have thought that this couplet from Basheer Badr’s treasure house would perfectly fits the current situation: ""Koi Haath Bhi Na Milayega Jo Gale Miloge Tapaak Se , Ye Naye Mizaaj Ka Shehr Hai Zara Faasle Se Mila Karo "" "
1850,2020-03-14 21:40:25,Nicola Sturgeon began easing herself away from Boris Johnson's coronavirus strategy on Thursday. Hopefully there will be more 'easing away' over the next couple of days. 
1851,2020-03-14 21:40:24,"If you’re looking for a textbook example of panoptic asymmetry, here it is: A Big Brother season in Germany where the participants have not been told about corona and won’t be unless someone gets sick. It’s unbearably literal. "
1852,2020-03-14 21:40:24,"Why outbreaks like coronavirus spread exponentially, and how to “flatten the curve” "
1853,2020-03-14 21:40:22,"Good afternoon. It’s been 24 hrs since @SenKamalaHarris called on Leader Mitch MCConnell to bring the Senate back to vote on the House-passed Coronavirus response which includes free testing, sick leave &amp; other help for Americans. Why hasn’t MCConnell called the Senate back yet? "
1854,2020-03-14 21:40:22,The Families First Coronavirus Response Act: • Free coronavirus testing • Emergency paid sick days • Emergency paid leave • Expanded unemployment insurance • Expanding food security Call your Senators and urge them to VOTE YES here’s how: 
1855,2020-03-14 21:40:10,Cannot understand why the death rate (of confirmed cases) from Covid-19 is c.6% in Italy and 0.2% in Germany. An enormous difference #COVIDー19
1856,2020-03-14 21:40:10,Jarvis Landry discussing the dangers of COVID-19 
1857,2020-03-14 21:40:04,"At least 40 U.S. states and territories have declared states of emergency in response to the coronavirus, giving them the authority to impose curfews, order traffic off the street and mandate quarantines "
1858,2020-03-14 21:40:02,"Question. Would it be helpful if the UK suspended all inbound air traffic from the #coronavirus riddled EU? If not, why not?"
1859,2020-03-14 21:40:01,"18 #coronavirus #COVID19 cases in this 1 town, &gt;25% of all cases in NJ! Mayor calling for all 40k residents to self-quarantine. My story at 6 @NBCNewYork #Teaneck"
1860,2020-03-14 21:40:00,President Donald Trump welcomed a bipartisan #coronavirus aid package passed by the House of Representatives that includes free coronavirus testing and paid sick leave https://reut.rs/2TZALjq
1861,2020-03-14 21:40:00,"""These donations are a small token that reflect my appreciation and support."" New Orleans Pelicans' Zion Williamson has made an incredible pledge to help those affected by the coronavirus. https://bbc.in/2vqCwho"
1862,2020-03-14 21:39:51,"France is 'locked down' with all non-essential public locations to close TONIGHT As coronavirus death toll in the country soars to 91 91 With French Prime Minister calling it the 'biggest health crisis in a century' Really How many died, this year, of the flu~ "
1863,2020-03-14 21:39:46,"Ellen Pompeo is giving a big shout-out to those fighting coronavirus on the ""front lines."" "
1864,2020-03-14 21:39:43,your second @has corona 
1865,2020-03-14 21:39:42,"If we can survive Obama, we can survive the Coronavirus."
1866,2020-03-14 21:39:38,"fucking hell i didn’t know that coronavirus gives u bloody diarrhoea, why are people so weird "
1867,2020-03-14 21:39:32,Trump World descended on Mar-a-Lago as it became a Coronavirus petri- Dish. Infected people without symptoms are driving the spread of coronavirus more than we realized. Does that mean Mar-a-lago is a cluster? 
1868,2020-03-14 21:39:28,A police officer in his 40s — is in critical condition after testing positive for the new coronavirus. 
1869,2020-03-14 21:39:13,"Thanks to Congress for a bipartisan #FamiliesFirst agreement that brings essential economic support for families and workers, seniors and other vulnerable populations who are being impacted by the coronavirus (#COVID19) outbreak. We now urge swift passage in the Senate."
1870,2020-03-14 21:39:01,I have a case of Corona. :3 @PepperMuzz @Cobalt900
1871,2020-03-14 21:38:50,"Whilst Ghanaians are Crying Over Corona Virus, @shattawalegh is Chilling with It "
1872,2020-03-14 21:38:46,Saw this making the rounds. I like the visual analogy. #SlowTheCurve #SlowTheSpread #CoronaVirus 
1873,2020-03-14 21:38:44,"here's what's happening in Texas while @JohnCornyn sips his shots of beer: local law enforcement officer is in hospital w #Covid_19 - fighting for his life but unconscious for days. great priorities, @TeamCornyn - bottoms up. Folks, please vote for the adult in the room @mjhegar"
1874,2020-03-14 21:38:42,"Hantianqi, the 98-year-old Chinese renowned astronomer, and his wife, both of whom contracted the #coronavirus, have been cured and fully recovered. The couple was discharged from #Wuhan’s hospital on Saturday."
1875,2020-03-14 21:38:41,"WA coronavirus survivor shares her story, advises others not to panic https://fxn.ws/2Qea8Gv #FoxNews"
1876,2020-03-14 21:38:39,Maryland Gov. Larry Hogan has signed an executive order to expand child care access for critical personnel during a state of emergency while schools are closed to prevent the spread of coronavirus. 
1877,2020-03-14 21:38:36,Think you’re invulnerable because you’re not over 80? Half of all covid patients in critical condition in France are under the age of 50 
1878,2020-03-14 21:38:35,"We simply don’t have the time. What you’re experiencing is ableism on a national scale. Early on, many wrote off the #coronavirus as something “just elderly and disabled (sick) people die from.” People felt they didn’t have to take action because only the most disposable 3/?"
1879,2020-03-14 21:38:35,We found the best corona virus video made so far #ftp
1880,2020-03-14 21:38:34,"With the assistance of @lightindustry, @ScreenSlate, &amp; other community partners, we have started a fund that can be accessed by cinema workers whose hours have been curtailed bc of the COVID-19 closures &amp; who are not being otherwise compensated. Pls give "
1881,2020-03-14 21:38:28,"Ah, sorry, misspoke. we’re not getting serious about coronavirus, we’re seriously getting coronavirus"
1882,2020-03-14 21:38:23,.@GloriaGaynor teaches us “how to survive” the Coronavirus pandemic in a new #TikTok. 
1883,2020-03-14 21:38:20,Send us links to buy your #smallbiz swag! @CitizensEdmond is open normal hours &amp; we’d love to outfit our team w/ local biz gear &amp; support you during this trying time! #coronavirus #1okc #edmond
1884,2020-03-14 21:38:16,"BREAKING NEWS: Its confirmed, ZANU PF chairperson Oppah Zvipange Muchinguri used macabre racist and dehumanising language to attack hundreds of victims of coronavirus in Chinhoyi. She celebrated deaths of innocent people on racial grounds. Disgusting but thats their mission here "
1885,2020-03-14 21:38:10,"My @JohnsHopkins colleagues are at the forefront of battling the #Coronavirus. The heroes at @HopkinsMedicine have created their own tests for the virus &amp; hope to test 1,000 people a day. This is how you fight a #Pandemic. #CoronavirusUpdates."
1886,2020-03-14 21:38:04,"ABC journalist @MaryLloyd4 with vital words ""I'm one of 4 per cent that coronavirus might kill. What you do today could save my life"" #COVIDー19 #coronavirus #COVID19Aus"
1887,2020-03-14 21:38:00,"IMPORTANT THREAD Hi friends, To assist in limiting the spread of the COVID-19 virus, we are cancelling April’s ephemera. The safety of our readers and guests is our top priority. We continue to monitor public health and will re-evaluate the situation closer to May. (Cont.)"
1888,2020-03-14 21:37:47,The street I grew up in and where my family still lives: big round of applause for healthcare and supermarket workers. Spain’s PM @sanchezcastejon just announced lockdown measures so the country can fight the #coronavirus pandemic. #Badajoz video by @malonbe8
1889,2020-03-14 21:37:46,two bros chilling in a pool five feet apart cause they don’t wanna get corona virus 
1890,2020-03-14 21:37:45,COVID-19 NEEDS AN ANTHEM. IT ALSO NEEDS A HERO. HIS NAME IS BILLY IDOL. THIS IS HOW WE WILL BEAT THIS THING. IT'S ALL LAID OUT IN THIS 1981 MUSIC VIDEO. SPREAD THE WORD. WE'RE GONNA BE OKAY!! #SWEAT
1891,2020-03-14 21:37:34,Someone tell Drake to wear this so the Coronavirus will end 
1892,2020-03-14 21:37:33,Rather catch Corona virus than catch feelings for someone again.
1893,2020-03-14 21:37:32,If we survive corona 20’ I’ll ask my extremely out of my league social media crush out
1894,2020-03-14 21:37:29,"Trump, his administration, Fox News, Rush Limbaugh, they all said Coronavirus was a hoax. It is not. Now I’m wondering that maybe all those other hoaxes might be real too????"
1895,2020-03-14 21:37:13,Am deciding the result of Trump’s Coronavirus test.
1896,2020-03-14 21:37:09,"i have 3 reactions when i leave the house: 1. ew, the weather 2. ew, the people 3. ew, coronavirus"
1897,2020-03-14 21:37:04,"“As the new coronavirus spreads across the United States, the time has come for restaurants, retailers and other industries that rely on low-wage labor to abandon their parsimonious resistance to paid sick leave."" "
1898,2020-03-14 21:37:02,Good to see that Senators are drunk tweeting about the coronavirus when they should be pushing through legislation about the coronavirus.
1899,2020-03-14 21:37:01,".@AyannaPressley on the coronavirus possibly spreading to prison populations: “Now would be the time to commute some sentences, to exact clemency and to take care of our most vulnerable. 10% of those incarcerated are over the age of 60 and already have an underlying condition."" "
1900,2020-03-14 21:37:00,If coronavirus was a shew it would be ZX Flux 
1901,2020-03-14 21:37:00,"The coronavirus pandemic has led to the postponement of the Premier League season with nine games remaining, but what have previous campaigns taught us?"
1902,2020-03-14 21:36:59,"Coronavirus Fatalities in 175 Cities Exceeded 4,500 Mrs. Rajavi: Not releasing prisoners is a great crime against humanity for which Khamenei is responsible, the world should intervene #coronavirus #COVIDー19"
1903,2020-03-14 21:36:50,"The rationing begins. Patient in resus needs non-invasive ventilation, with suspected Covid-19. Has a DNAR. No anaesthetist wants to risk their health by using NIV in neg pressure room. ""We have to protect ourselves"" No NIV. I will call the family in now then.. #COVID19"
1904,2020-03-14 21:36:46,"Infighting, missteps and a son-in-law hungry for action: Inside the Trump administration's troubled coronavirus response, by @AshleyRParker @PhilipRucker @yabutaleb7 @jdawsey1"
1905,2020-03-14 21:36:39,"That's it, we're in lock down. Only retail places open now are banks, grocery stores, petrol stations and pharmacies. #Coronavirus #COVID19"
1906,2020-03-14 21:36:39,Since I found out dogs can’t get COVID-19 
1907,2020-03-14 21:36:37,Has ANY journalist asked why the Presidency is quiet on this life threatening #Coronavirus epidemic or they thinking about their stomachs? Isn't the job of journalists to hold government accountable and be on the side of citizens? Is there a journalist in South Africa?
1908,2020-03-14 21:36:31,"This is HUGE. One of America's top psychiatrists just explained WHY Trump won't take responsibility for the #coronavirus response his government fails, and how to make his MAGAs snap out of it! #CoronavirusPandemic"
1909,2020-03-14 21:36:23,"Patiently explaining to my mom that even though “dad has been doing a lot of reading,” there is no evidence that the coronavirus started in a lab in China—and that it isn’t likely China “did this to hurt Trump.”"
1910,2020-03-14 21:36:16,oh. my. GODDD : Anna Farris finds out you have Coronavirus 
1911,2020-03-14 21:36:13,Amongst all this coronavirus panic i STILL be goin “Damn Kobe ” ...also did i jus say amongst?! 
1912,2020-03-14 21:35:56,"When I was working at Dominos 10 years ago I was trying to get freelance bits for some more experience in football. COVID-19 is going to be tough for a lot of freelancers, but if you add your details to this doc I'll share it with as many editors as poss. "
1913,2020-03-14 21:35:52,"Infighting, missteps and a son-in-law hungry for action. Inside the Trump administration’s troubled coronavirus response, which is increasingly led by Jared Kushner. W/⁦@AshleyRParker⁩, ⁦@PhilipRucker⁩ &amp; ⁦@yabutaleb7⁩:"
1914,2020-03-14 21:35:48,"As coronavirus spreads rapidly around the world, the long-anticipated monster is finally at the door. Mike Davis argues that with global capitalism so impotent in the face of this crisis, our demands must be for international public-health infrastructure. "
1915,2020-03-14 21:35:44,A great read Coronavirus: What are the British up to? via @RTENewsNow
1916,2020-03-14 21:35:42,"When @realDonaldTrump claimed that ""anyone"" could get a #coronavirus test, I guess that ""anyone"" meant any senior-level @GOP. "
1917,2020-03-14 21:35:41,This corona virus situation is really showing people’s true colours man I feel like a lot of people are gonna have a lot less friends after u realise how selfish everyone is
1918,2020-03-14 21:35:40, BREAKING NEWS @VDHgov confirms the first #coronavirus death in Virginia out of the Peninsula Health District (James City County). The patient was a man in his 70’s and died from respiratory failure as a result of COVID-19. VDH says it is unknown how he contracted COVID-19.
1919,2020-03-14 21:35:33,"“We will lead by science,” Joe Biden says, adding that “downplaying” the threat of the coronavirus or “being overly dismissive or spreading misinformation is only going to hurt us and further advantage the spread of the disease.” https://abcn.ws/33g7AwO"
1920,2020-03-14 21:35:32,(My corona test results just came in)
1921,2020-03-14 21:35:23,"On Boris Johnson's phone call with Morrison: ""The two leaders agreed to take a science based approach to the coronavirus"" WHAT OTHER APPROACH IS THERE TO TAKE?! @sunriseon7 #auspol"
